{"$schema":"https://json-schema.org/draft/2020-12/schema","title":"DevFlower dual-review policy v1 (design contract)","type":"object","additionalProperties":false,"required":["schema_version","profile","mode","agents","limits","delivery","required_contracts","verification","authorization_required"],"properties":{"schema_version":{"const":1},"profile":{"const":"dual-review"},"mode":{"enum":["A","B","C"]},"authorization_required":{"const":true},"agents":{"type":"object","additionalProperties":false,"required":["implementer","reviewer"],"properties":{"implementer":{"type":"object","additionalProperties":false,"required":["adapter","session_policy","model_policy"],"properties":{"adapter":{"const":"codex-cli"},"session_policy":{"enum":["new","resume-bound"]},"model_policy":{"const":"approved-local-binding"}}},"reviewer":{"type":"object","additionalProperties":false,"required":["adapter","session_policy","model_policy"],"properties":{"adapter":{"const":"claude-cli"},"session_policy":{"enum":["new","resume-bound"]},"model_policy":{"const":"approved-local-binding"}}}}},"limits":{"type":"object","additionalProperties":false,"required":["max_review_rounds","max_infrastructure_retries","step_timeout_seconds","max_log_bytes"],"properties":{"max_review_rounds":{"type":"integer","minimum":1,"maximum":20},"max_infrastructure_retries":{"type":"integer","minimum":0,"maximum":5},"step_timeout_seconds":{"type":"integer","minimum":30},"max_log_bytes":{"type":"integer","minimum":4096}}},"delivery":{"type":"object","additionalProperties":false,"required":["commit","push","merge","force","tag","release"],"properties":{"commit":{"type":"boolean"},"push":{"type":"boolean"},"merge":{"const":false},"force":{"const":false},"tag":{"const":false},"release":{"const":false}}},"required_contracts":{"type":"array","minItems":1,"uniqueItems":true,"items":{"type":"string","minLength":1}},"verification":{"type":"array","minItems":1,"items":{"type":"object","additionalProperties":false,"required":["id","argv","result_format","min_cases","max_skipped"],"properties":{"id":{"type":"string","minLength":1},"argv":{"type":"array","minItems":1,"items":{"type":"string","minLength":1}},"result_format":{"enum":["junit","controller-json"]},"min_cases":{"type":"integer","minimum":1},"max_skipped":{"type":"integer","minimum":0},"runner":{"enum":["exit-code","json-assertion"]},"stdin":{"type":"string"},"expected_json":{},"read_paths":{"type":"array","items":{"type":"string"}},"dependency_sha256":{"type":"object"}}}}},"allOf":[{"if":{"properties":{"delivery":{"properties":{"push":{"const":true}}}}},"then":{"properties":{"delivery":{"properties":{"commit":{"const":true}}}}}}]}
